id,created_at,text
474859637284831232,2014-06-06 10:25:34,b'Our thanks to law enforcement officers in New Brunswick - thoughts remain with all those affected by this senseless violence. #cdnpoli'
474714457051246592,2014-06-06 00:48:40,b'The newest episode of 24 SEVEN is live! Check it out here: http://t.co/LR0LWu2W9F #cdnpoli #CampDay #G7 #SavingLives'
474605018063319041,2014-06-05 17:33:48,"b'Wheels down, Deauville.  #cdnpoli'"
474556623760142336,2014-06-05 14:21:30,b'Delivering remarks at a press conference in Brussels. #cdnpoli http://t.co/QXPbg08Xmm'
474486020852187136,2014-06-05 09:40:57,b'G7 family photo. #cdnpoli #G7Brussels http://t.co/4eD0EOgmd9'
474483355627847680,2014-06-05 09:30:22,b'Working session with #G7 leaders during day 2 of the\xc2\xa0#G7\xc2\xa0Summit in Brussels #cdnpoli #G7Brussels http://t.co/eZ50U7tWto'
474477120505511936,2014-06-05 09:05:35,"b'Bilateral meeting with the President of France,\xc2\xa0@FHollande\xc2\xa0during the #G7 Summit in Brussels #cdnpoli #G7Brussels http://t.co/3hPuCfypfc'"
474458903099760640,2014-06-05 07:53:12,b'Laureen &amp; I offer our deepest condolences to the all those affected by the terrible tragedy in Moncton. Read more: http://t.co/4bUFAF4Uyb'
474375369743949824,2014-06-05 02:21:16,b'RT @MinStevenBlaney: Shocked by the tragedy in #Moncton. Thoughts and prayers with our frontline @rcmpgrcpolice officers and families.'
474297800470315010,2014-06-04 21:13:02,b'#G7 working dinner. #cdnpoli http://t.co/FVdpKKpsbT'
474245745852555264,2014-06-04 17:46:11,b'RT @tdsb: Last week we welcomed @pmharper to Davisville PS &amp; w/ special guests. Photos are now on FB: https://t.co/pCXYdiZRfV http://t.co/E\xe2\x80\xa6'
474245541732548608,2014-06-04 17:45:22,b'Meeting with President of the European Commission @BarrosoEU in Brussels. #G7 #cdnpoli http://t.co/JO9jSROJ19'
474214102144151552,2014-06-04 15:40:27,"b'Wheels down, Brussels. #cdnpoli'"
474172220340973568,2014-06-04 12:54:01,b'Met w/ Ukrainian President Elect Petro Poroshenko &amp; Polish Minister of Foreign Affairs Rados\xc5\x82aw Sikorski in #Warsaw. http://t.co/mcC2etfD39'
474152206472867840,2014-06-04 11:34:30,b'Family photo with @prezydentpl and other delegates at the Royal Castle. #Poland #cdnpoli http://t.co/HqZuhF9lVY'
474147505043558402,2014-06-04 11:15:49,b'Welcoming ceremony at the Royal Castle in Warsaw. #cdnpoli http://t.co/EAAWxLp7LE'
474145102105808896,2014-06-04 11:06:16,b'Joint media availability with Polish PM Donald Tusk at the Chancellery in Warsaw. #cdnpoli http://t.co/C0ii6JUBYB'
474091115155820544,2014-06-04 07:31:44,"b'Greeted at the Chancellery in Warsaw by Donald Tusk, Prime Minister of #Poland. #cdnpoli http://t.co/6xlKSmQo5g'"
473938711642509312,2014-06-03 21:26:08,b'I will be in #Ukraine on June 7 for Petro Poroshenko\xe2\x80\x99s swearing-in ceremony. Details here: http://t.co/FiYsrAjA71 #cdnpoli'
473809956253478912,2014-06-03 12:54:31,"b'Wheels up to Warsaw, Poland. #cdnpoli http://t.co/E7RUTCArLj'"
473503802130460673,2014-06-02 16:37:58,b'I look forward to welcoming Australian Prime Minister @TonyAbbottMHR to Canada next week. Details: http://t.co/I0KlCb7IzP #cdnpoli'
473215536642273280,2014-06-01 21:32:30,b'It was an honour to speak at the Tribute to Liberty dinner on Friday. Watch my full speech here: http://t.co/945YQNIeHT #cdnpoli'
473145492030124033,2014-06-01 16:54:10,b'Today is Canadian Armed Forces Day - join me in extending our heartfelt gratitude and appreciation: http://t.co/ukk64iA3lv #cdnpoli'
472907611030175745,2014-06-01 01:08:55,"b""No hockey tonight so @LaureenHarper &amp; I are watching Team Canada World League volleyball. Let's go Team Canada! #FIVBWorldLeague #WLCAN2014"""
472834801909907457,2014-05-31 20:19:36,"b'24 SEVEN spoke to @LuckyIronFish, @GChallenges, &amp; @Micronutrient about their accomplishments in #MNCH. Watch here: http://t.co/wJx79wu3gs'"
472561624687976448,2014-05-31 02:14:05,b'.@LaureenHarper &amp; I caught up with @RobertHerjavec and his wife Diane before the #TributetoLiberty dinner in Toronto http://t.co/ECGCfFDkJm'
472499869010370560,2014-05-30 22:08:42,"b'In this 24 SEVEN Exclusive, I reflect on the #MNCH conference. Watch:  https://t.co/PGvm3doaFH  #cdnpoli #SavingLives'"
472458112168099840,2014-05-30 19:22:46,b'Our commitment to #SavingLives of mothers &amp; children will not waver. #MNCH wrap-up: http://t.co/kDoPphen2E #cdnpoli'
472434279440736256,2014-05-30 17:48:04,"b'Thanks to all of the #MNCH staff, volunteers and participants who made this event a success! #cdnpoli #SavingLives http://t.co/FeeC9UIxrB'"
472411570375753728,2014-05-30 16:17:50,b'Moderating a Q&amp;A session on #SavingLives at the third day of the #MNCH conference. #cdnpoli @rajshah @jmkikwete http://t.co/Pq2izlefI5'
472403765514211328,2014-05-30 15:46:49,"b'Together, we can improve the lives of women and children in developing countries. Canada is #SavingLives http://t.co/gjg6K9bRyX'"
472369596927066112,2014-05-30 13:31:02,b'RT @Canadamidwives: \xe2\x80\x9cThank you @pmharper for your #MNCH speech! Midwives in Canada stand ready to help #SavingLives\xe2\x80\x9d'
472208333555113984,2014-05-30 02:50:14,b'Congratulations to the @canadiensmtl  for a very exciting playoff run! I  hope next year more canadian teams will join you!'
472198187948986368,2014-05-30 02:09:55,b'Check out this week\xe2\x80\x99s episode of 24 SEVEN for the latest from the #MNCH conference and more! https://t.co/olD0GElClm #cdnpoli #SavingLives'
472163955490570240,2014-05-29 23:53:54,"b""Let's push for a game 7! @CanadiensMTL #GoHabsGo"""
472123567170412544,2014-05-29 21:13:24,"b'RT @melindagates: Great day at the #SavingLives Summit with @PMHarper, @QueenRania, and so many champions for women and children. http://t.\xe2\x80\xa6'"
472096003630592001,2014-05-29 19:23:53,"b'Learn about how Canada has helped, and continues to help, #SavingLives of millions of mothers and children: http://t.co/JyRsyg8FlX #cdnpoli'"
472090035853209600,2014-05-29 19:00:10,b'There is a moral imperative to #SavingLives of vulnerable women&amp;children in the poorest countries when it is in our power to do so. #cdnpoli'
472076446719283200,2014-05-29 18:06:10,"b'From the conference floor, a 24 SEVEN Exclusive with members of the #MNCH Steering Committee: http://t.co/0dYwLLJr6k #cdnpoli #SavingLives'"
472074422254583808,2014-05-29 17:58:07,b'Speaking with @melindagates at #MNCH about the importance of taking care of women &amp; children. #cdnpoli #SavingLives http://t.co/2rfb64Vxah'
472051899215409152,2014-05-29 16:28:37,"b'RT @DFATD_DEV: #SavingLives @LaureenHarper is with us  to introduce our keynote speaker, @MelindaGates #SavingLives @GatesFoundation...'"
472032025801916416,2014-05-29 15:09:39,"b""RT @HonJohnBaird: Horrific 'honour killings' are all too common in #Pakistan, more than 800 women have reportedly been targeted over the la\xe2\x80\xa6"""
472031969724076032,2014-05-29 15:09:26,"b""RT @HonJohnBaird: Appalled by the stoning of a pregnant woman in #Pakistan. These brutal so-called 'honour killings' are unacceptable. http\xe2\x80\xa6"""
472016249397198849,2014-05-29 14:06:58,b'Meeting with @QueenRania Al Abdullah of Jordan at the #MNCH conference in Toronto. #cdnpoli #SavingLives http://t.co/FO1Y3f9pxe'
471997513680289792,2014-05-29 12:52:31,b'RT @DFATD_DEV: Watch our #SavingLives live stream in approx 30 minutes http://t.co/s4AlYrONY5'
471818105585680384,2014-05-29 00:59:36,"b'Dinner at the #MNCH with @LaureenHarper, His Highness the Aga Khan, &amp; Tanzanian President @jmkikwete. #cdnpoli @akdn http://t.co/eQu1tkTb8P'"
471767409058410497,2014-05-28 21:38:09,b'This Summit will provide an opportunity for us to focus on this common goal of global importance. http://t.co/9X4PpDlkaZ  #SavingLives'
471766406108024832,2014-05-28 21:34:10,"b'Canada\xe2\x80\x99s top development priority is #SavingLives of mothers, newborns &amp; children in developing countries: http://t.co/9X4PpDlkaZ #cdnpoli'"
471756247835090946,2014-05-28 20:53:48,"b'In Toronto today for the Saving Every Woman, Every Child - Within Arm\xe2\x80\x99s Reach summit. #cdnpoli #SavingLives #MNCH http://t.co/C89tbwXzjV'"
471740522126917632,2014-05-28 19:51:19,b'Watch the livestream of the #MNCH conference here: http://t.co/TJABhUUsu8 #cdnpoli #SavingLives'
471740113811410944,2014-05-28 19:49:42,b'Met with Tanzanian President @jmkikwete before the start of the #MNCH conference. #cdnpoli #SavingLives http://t.co/7UfCwEh14d'
471715102656573440,2014-05-28 18:10:19,b'RT @DFATD_DEV: The #MNCH Summit starts today. Tweet us using #SavingLives &amp; tell us what this means to you. Be part of the movement'
471709955314442240,2014-05-28 17:49:51,"b'Welcome to Twitter, Bruce\xe2\x80\x93Grey\xe2\x80\x93Owen Sound MP @LarryMillerMP! #cdnpoli'"
471700650288775168,2014-05-28 17:12:53,b'Thank you Senator Dallaire for your service to Canadians. Best wishes for the future. #cdnpoli'
471484071823278080,2014-05-28 02:52:17,b'This team never gives up. @CanadiensMTL #GoHabsGo'
471441475088420864,2014-05-28 00:03:01,b'Watch @MPJoySmith talk about the importance of the MNCH conference in this 24 SEVEN Exclusive: https://t.co/W844H6zWOj #cdnpoli #SavingLives'
471379212151308289,2014-05-27 19:55:36,b'Canada continues to be a leader in pressing for global action on MNCH issues. Learn more: http://t.co/DYMzeIZy6I #cdnpoli #SavingLives'
471329794895122433,2014-05-27 16:39:14,b'RT @joeoliver1: I welcome the new guidelines &amp; voluntary commitments by banks on low cost &amp; no cost accounts. Putting consumers first http:\xe2\x80\xa6'
471307830780526592,2014-05-27 15:11:57,"b'24 SEVEN Exclusive: Saving Every Woman, Every Child-Within Arm\xe2\x80\x99s Reach. #MNCH summit details: http://t.co/eDpieQ6b7w #cdnpoli #SavingLives'"
471002744292380672,2014-05-26 18:59:39,b'Had a courtesy meeting with Premier of the Turks and Caicos Islands @docrewing today. #cdnpoli http://t.co/2J9JI2kSO8'
470726560123994112,2014-05-26 00:42:12,b'Congratulations to the @EdmOilKings for their #MemorialCup Victory. What a great end to a very exciting season!'
470688293672067072,2014-05-25 22:10:08,b'Laureen &amp; I extend our condolences to the family of Marcel C\xc3\xb4t\xc3\xa9. We join w/ all Cdns in thanking him for his contributions to public life.'
470673501943496705,2014-05-25 21:11:22,b'Congratulations to the people of #Ukraine for taking this important step towards rebuilding democracy. CDA will continue to stand by you. \xc2\xa0'
470618613372551168,2014-05-25 17:33:15,"b'On behalf of all Cdns, Laureen &amp; I offer our deepest condolences to the friends &amp; family of Knowlton Nash. Read more: http://t.co/z8EHPB0xGk'"
470301941747027968,2014-05-24 20:34:55,"b'Congratulations to Montreal film maker, Xavier Dolan, for his ex-aequo Prix du Jury at Festival de Cannes. #Cannes2014'"
469942414988574720,2014-05-23 20:46:17,b'Next week I\xe2\x80\x99ll be at the Saving Every Woman Every Child: Within Arm\xe2\x80\x99s Reach Summit. Details: http://t.co/DYMzeIZy6I #cdnpoli #SavingLives'
469918189502353408,2014-05-23 19:10:01,"b'ICYMI: Watch the latest 24 SEVEN, featuring The Prince of Wales &amp; The Duchess of Cornwall: http://t.co/8n1IezGuLj #cdnpoli @ClarenceHouse'"
469587311383285761,2014-05-22 21:15:14,b'The latest 24 SEVEN is live! Clips of the Royal Visit &amp; @HonJohnBaird speaking in Washington. Watch here: http://t.co/8n1IezGuLj #cdnpoli'
469544970341584896,2014-05-22 18:26:59,b'Congrats to @Pou29 for being named the 2014-15 @BUwhockey team captain.  I\xe2\x80\x99m sure you will continue to represent Canada with pride.'
469537371697201152,2014-05-22 17:56:47,"b'I\xe2\x80\x99ll also be marking #DDay in Normandy, France &amp; the Polish Day of Freedom in Warsaw, Poland. Find out more: http://t.co/3rQaBQRlh3 #cdnpoli'"
469536696523309056,2014-05-22 17:54:06,b'In two weeks I\xe2\x80\x99ll be travelling to Belgium to participate in the #G7 Brussels Summit. Details here: http://t.co/3rQaBQRlh3 #cdnpoli'
469324084669857792,2014-05-22 03:49:16,b'2/2 This terrible accident is a painful reminder of how Cdn Armed Forces members put their lives at risk for Canada. http://t.co/1CDAY6jRtJ'
469323765478723584,2014-05-22 03:47:59,b'1/2 Our thoughts &amp; prayers are w/ the family of Lieutenant-Colonel Daniel Bobbitt &amp; the others who were seriously injured on CFB Wainwright.'
469195514626707457,2014-05-21 19:18:22,"b""RT @RCGS_SGRC: We're so honoured to receive a gift on behalf of @ClarenceHouse! A wonderful legacy of a wonderful visit! http://t.co/Y93u2q\xe2\x80\xa6"""
469184603740450816,2014-05-21 18:35:01,"b'RT @RCGS_SGRC: HUGE thanks to @pmharper for this major gift to @RCGS_SGRC, which will help make Canada better known to Canadians! http://t.\xe2\x80\xa6'"
469177597432430592,2014-05-21 18:07:10,"b'Flying paper airplanes w/ @LaureenHarper, The Prince of Wales &amp; Duchess of Cornwall in Winnipeg. @ClarenceHouse http://t.co/6waQNjYtNo'"
469168880368492545,2014-05-21 17:32:32,b'.@LaureenHarper and I are honoured to join The Prince of Wales and Duchess of Cornwall in Manitoba today. #cdnpoli http://t.co/NJyYVyooUo'
468859515296026624,2014-05-20 21:03:14,b'Sen Andreychuk &amp; former Ontario Premier Mike Harris will lead our election observation mission to #Ukraine: http://t.co/5SPLcTtuhJ #cdnpoli'
468548324178407424,2014-05-20 00:26:40,"b""What's better than watching the game with the coach? Also with @Min_Lebel! #gohabsgo @CanadiensMTL http://t.co/Zfxd9Lgiuw"""
468544552240812032,2014-05-20 00:11:41,b'Had the chance to speak to the coach before game 2 #gohabsgo @CanadiensMTL \xc2\xa0 http://t.co/qsgPz3AOOC'
468422348732121088,2014-05-19 16:06:05,"b'Happy Victoria Day! On behalf of all Canadians, @LaureenHarper and I wish Her Majesty a very happy birthday: http://t.co/aBGyqVCfWW #cdnpoli'"
468189578013462528,2014-05-19 00:41:08,b'RT @GGDavidJohnston: Allow me to introduce you to the newest member of the Queen\xe2\x80\x99s Privy Council for Canada. #RoyalTour http://t.co/X19FRPn\xe2\x80\xa6'
468180466483593217,2014-05-19 00:04:56,"b""I'd like to welcome the Prince of Wales and The Duchess of Cornwall to Canada: http://t.co/9hpT7OpzXF #cdnpoli"""
468101700428234752,2014-05-18 18:51:56,b'I called @narendramodi this morning to congratulate him on his election win and to discuss strengthening Canada - India relations. #cdnpoli'
467711057340157952,2014-05-17 16:59:40,b'Hope to see a strong start in the Eastern Conference final! #GoHabsGo'
467391516059910144,2014-05-16 19:49:55,b'RT @CPC_HQ: Our National Conservation Plan will help protect the environment \xe2\x80\x93 download your free fact sheet here: http://t.co/JE3n4qhiD4 #\xe2\x80\xa6'
467349580250902528,2014-05-16 17:03:17,"b'In the latest 24 SEVEN, I consider a somewhat dramatic wardrobe change. Check it out: http://t.co/HTuCTprakz #cdnpoli'"
467327884844367872,2014-05-16 15:37:04,b'Congratulations @narendramodi on your election win in India. I look forward to working with your new gov\xe2\x80\x99t. http://t.co/L9ztNjPXtK #cdnpoli'
467047629374115840,2014-05-15 21:03:26,"b""In this week's 24 SEVEN: Canadians salute the troops, @LaureenHarper visits the rockies, and more. Watch: http://t.co/HTuCTprakz #cdnpoli"""
467031289175232513,2014-05-15 19:58:31,b'Our #ConservationPlan will provide a coordinated approach to conservation efforts across Canada. Learn how: http://t.co/gitOIfAhrg #cdnpoli'
467003545041240064,2014-05-15 18:08:16,"b'RT @ParksCanada: National #ConservationPlan: securing ecologically sensitive lands, restoring wetlands + more http://t.co/2sv2vPijlP http:/\xe2\x80\xa6'"
466995129963003904,2014-05-15 17:34:49,"b'This #ConservationPlan will conserve our lands &amp; waters, restore our ecosystems, and connect Cdns to nature: http://t.co/8si9NvxICd #cdnpoli'"
466990973596467200,2014-05-15 17:18:19,b'In New Brunswick this morning launching the National #ConservationPlan. Learn more: http://t.co/8si9NvxICd #cdnpoli http://t.co/LHlpYkEVdK'
466757539523465216,2014-05-15 01:50:44,b'Great to see a Canadian team finally take out the Bruins in a game 7. #GoHabsGo @CanadiensMTL'
466710736933515264,2014-05-14 22:44:45,b'#GoHabsGo @CanadiensMTL'
466705789277978624,2014-05-14 22:25:05,b'.@LaureenHarper &amp; I would like to express our condolences to the friends &amp; families of those affected by the tragic mine accident in Turkey.'
466044228305698816,2014-05-13 02:36:17,"b""It's only fitting that a Habs - Bruins series would go to game 7. Looking forward to Wednesday! #GoHabsGo"""
465985244051804160,2014-05-12 22:41:54,"b""Tonight, like millions of Canadians, I'll be cheering for the Habs. We want a game 7! #GoHabsGo @CanadiensMTL"""
465955261581393920,2014-05-12 20:42:46,"b""We're introducing legislation to honour the sacrifices of police officers &amp; their service animals. More: http://t.co/ykjP0lu6SF #cdnpoli"""
465914957964800001,2014-05-12 18:02:36,"b'.@LaureenHarper, @MinRonaAmbrose &amp; I met with Cst. Williamson &amp; Ozzie at the Edmonton K9 unit. #cdnpoli http://t.co/es0G8L5biq'"
465556076981940224,2014-05-11 18:16:33,"b""Wishing @LaureenHarper and all mothers across Canada a Happy Mother's Day. http://t.co/LuhyPjZN5O #cdnpoli"""
465276970452807680,2014-05-10 23:47:28,"b'Friday, Canadians marked the national #dayofhonour. Watch highlights of this historic moment.\nhttps://t.co/ULS6XjNSJr'"
465203477963374592,2014-05-10 18:55:26,"b'My thoughts are w the three injured RCMP officers &amp; their families from St Paul, AB. @LaureenHarper &amp; I wish them a speedy &amp; full recovery.'"
464886535717134336,2014-05-09 21:56:01,b'God bless the Canadian Armed Forces and their families and keep them safe. #DayofHonour'
464839467602563072,2014-05-09 18:49:00,"b'Too often in the past, our soldiers have returned to Canada with little fanfare. Not so today. #cdnpoli #DayofHonour http://t.co/UstbEnXZlu'"
464831586769567744,2014-05-09 18:17:41,"b'RT @CanadianForces: Chief of Defence Staff Gen Tom Lawson: on this day when it was supposed to rain, the sun is shining down in our soldier\xe2\x80\xa6'"
464826220669337600,2014-05-09 17:56:21,"b""RT @CanadianForces: Each of the type of aircraft in today's fly-by helped save Canadian lives. #DayofHonour http://t.co/lvMtkmFa8e"""
464817971765215232,2014-05-09 17:23:35,b'I ask all Cdns to join me as we observe a moment of silence in remembrance of those lost in Afghanistan at 1:30PM ET. #cdnpoli #DayofHonour'
464810617971687424,2014-05-09 16:54:21,"b'RT @CanadianForces: In 2001, only boys attended school in #Afghanistan - now more than 2.2 mil Afghani girls have access to education. #Day\xe2\x80\xa6'"
464805529806995456,2014-05-09 16:34:08,"b""RT @CanadianForces: The #CAF's mission in Afghanistan was underway for much of this newest generation's existence. #DayofHonour"""
464805425201020928,2014-05-09 16:33:43,b'RT @CanadianForces: Students who graduate this year were just starting school when the #CAF first deployed to Afghanistan in 2001. #DayofHo\xe2\x80\xa6'
464802696068100097,2014-05-09 16:22:53,b'Can\xe2\x80\x99t make it to a #DayofHonour event today? Watch the livestream: http://t.co/HO7fojX7Df #cdnpoli'
464794711698714625,2014-05-09 15:51:09,b'Taking part in the sombre #DayofHonour memorial service in the Senate. #cdnpoli http://t.co/vvLRxqCzUP'
464792230549815299,2014-05-09 15:41:17,b'Watch as the 24 SEVEN team follows along with @SoldierOnCAN\xe2\x80\x99s remarkable journey from Trenton to Ottawa http://t.co/s2bszSRdW6 #DayofHonour'
464780504806752257,2014-05-09 14:54:42,"b""RT @girlguidesofcan: It's the National Day of Honour in Canada. Girl Guides proudly supported our troops in Afghanistan #DayofHonour http:/\xe2\x80\xa6"""
464771841165627392,2014-05-09 14:20:16,b'RT @RugbyCanada: Today is National #DayOfHonour to recognize the dedication of the Men &amp; Women in the @CanadianForces! #WelcomeHome https:/\xe2\x80\xa6'
464766636877037569,2014-05-09 13:59:35,b'Starting the #DayofHonour with the @tplfoundation\xe2\x80\x99s breakfast reception. #cdnpoli http://t.co/OvG78x4TiD'
464759251257556992,2014-05-09 13:30:15,b'RT @GGDavidJohnston: I\xe2\x80\x99m starting this #DayofHonour by walking with the @SoldierOnCAN Afghanistan Relay participants @RideauHall. #SOAR htt\xe2\x80\xa6'
464756777842917376,2014-05-09 13:20:25,b'RT @HonRobNicholson: I am humbled and honoured to share part of this National #DayofHonour with the families of the fallen.'
464752207020449792,2014-05-09 13:02:15,b'RT @CFOperations: Canadian Air Task Force salutes during National #dayofhonour ceremony on parade grounds in Romania http://t.co/SOjuFuO6Ft\xe2\x80\xa6'
464563151615578115,2014-05-09 00:31:01,"b""In preparation for tomorrow's #DayofHonour ceremonies, the Canadian Forces Chinook lands on Parliament Hill. http://t.co/luVsk9ygNw"""
464540600533286912,2014-05-08 23:01:24,b'Jamaal Magloire of the Toronto @Raptors thanks our troops for their service: https://t.co/DHgE9pToRY #cdnpoli #DayofHonour'
464525990887440384,2014-05-08 22:03:21,b'Tmrw is the National #DayofHonour.I encourage you all to mark the day by attending an event in your area: http://t.co/MiiSej4Yq1 #cdnpoli'
464519429460860929,2014-05-08 21:37:17,b'Very proud of @TimHortons \xe2\x80\x93 offering free coffee to members of the CAF on the National #DayofHonour. #cdnpoli #TBT http://t.co/JOEmfDOJrB'
464510752439959554,2014-05-08 21:02:48,"b'In this week\xe2\x80\x99s 24 SEVEN: #Ukraine, @PMBreedlove, #LDNOnt, #Vaisaki, @LaureenHarper &amp; much more! Watch now: https://t.co/kRtNQXFxiV #cdnpoli'"
464502753344385028,2014-05-08 20:31:01,b'Former Toronto @MapleLeafs centre Darryl Sittler sends a message out to our troops: https://t.co/4PO81Pmwvt #cdnpoli #DayofHonour #TMLTalk'
464492456139304960,2014-05-08 19:50:06,b'Watch &amp; learn about how Canada made a huge positive difference in the lives of Afghans: https://t.co/UY0NGxUn1q #cdnpoli #DayofHonour'
464487876018061312,2014-05-08 19:31:54,b'RT @JTreliving: @pmharper.  Very humbling should be watched by every Canadian.  Our troops make us very proud on defending our Freedom and \xe2\x80\xa6'
464486983776370689,2014-05-08 19:28:21,b'Canada played a major role in building &amp; training the Afghan Nat\xe2\x80\x99l Army &amp; Police force: https://t.co/V6BO2OwqsW #cdnpoli #DayofHonour'
464477915347169280,2014-05-08 18:52:19,b'Amazing video - watch our soldiers explain the importance of their mission in Afghanistan: https://t.co/hnqKsff00u #cdnpoli #DayofHonour'
464471043374342144,2014-05-08 18:25:00,b'Our country lost 158 military personnel in Afghanistan. Please watch this video and RT. https://t.co/DOU9qJVrgT #cdnpoli #DayofHonour'
464466621055373312,2014-05-08 18:07:26,b'The Soldier on Afghan Relay team completes day two of the six-day relay - watch the video: https://t.co/Tnl499Dhvb #cdnpoli #DayofHonour'
464459371955888128,2014-05-08 17:38:38,b'Lieutenant Colonel Simon Bernard wishes us an excellent National #DayofHonour. Watch: https://t.co/yda2OIxM42 #cdnpoli'
464425923501359104,2014-05-08 15:25:43,"b'This V-E Day, I encourage all Cdns to learn more about this important chapter in our history. https://t.co/i1LtVOln69 http://t.co/Lg9M8VLhqJ'"
464398511883431936,2014-05-08 13:36:47,"b""Today, Canada &amp; the int'l community commemorate the 69th anniv. of the Allied victory over Nazi Germany. Read more: http://t.co/gZ6PfgBdHG"""
464213399014871040,2014-05-08 01:21:13,b'#CFL commissioner Mark Cohon\xe2\x80\x99s #DayofHonour message for our troops: https://t.co/EJUtNjORHz #cdnpoli @canadiancommish'
464178001065046016,2014-05-07 23:00:34,b'Capt Jesse van Eijk reflects on all that was achieved and sacrificed in Afghanistan:: https://t.co/PuUX4cloM2 #cdnpoli #DayofHonour'
464170328365989889,2014-05-07 22:30:04,b'A special #DayofHonour message from the Toronto @BlueJays: https://t.co/2JZpde36UE #cdnpoli #BlueJays'
464162772239253504,2014-05-07 22:00:03,b'Sargent R\xc3\xa9mi Nay talks about one of the key moments of his mission in Afghanistan: https://t.co/690H7EotRH #cdnpoli #DayofHonour'
464147963091365888,2014-05-07 21:01:12,b'Canada\xe2\x80\x99s Armed Forces are ready when they are needed. Watch this RCAF video: https://t.co/fROKH7Aki9 #cdnpoli #DayofHonour'
464132559375728641,2014-05-07 19:59:59,b'A montage of CAF members part of OP Apollo in the Gulf of Oman: https://t.co/FSGdp40HdN #cdnpoli #DayofHonour'
464119414410215425,2014-05-07 19:07:45,b'BG Omer Lavoie remarks on the dedication of the soldiers who served w/ him in Afghanistan. http://t.co/LUlroXLHUT #cdnpoli #DayofHonour'
464102335527268352,2014-05-07 17:59:54,b'Hear Major Rhonda Matthews talk about her two tours in Afghanistan: http://t.co/W39y6eoZoq #cdnpoli #DayofHonour'
463871755354775552,2014-05-07 02:43:39,b'Well deserved win for the Canadiens tonight.  Keep it up! #GoHabsGo @CanadiensMTL'
463820263415504896,2014-05-06 23:19:02,b'Had a great time at #Vaisakhi on the Hill earlier today! @MinTimUppal @ParmGill #cdnpoli http://t.co/Kiz75Szz4b'
463800394494115840,2014-05-06 22:00:05,"b'A message to our troops from Eugene Melnyk, owner of the @NHL_Sens: https://t.co/OrDaK5KwB8 #NHL #Senators #DayofHonour #cdnpoli'"
463792849377452033,2014-05-06 21:30:06,b'Hear @CanadiensMTL goalie Carey Price thank our soldiers in advance of the Nat\xe2\x80\x99l #DayofHonour: https://t.co/j6389bAlAh #Habs @CP0031'
463785886317301760,2014-05-06 21:02:26,b'Ryan Nugent-Hopkins of the @NHL_Oilers thanks Cdn soldiers for their service: https://t.co/9IrZXqzBwM #cdnpoli #NHL @RNH_93 #DayofHonour'
463777744657338368,2014-05-06 20:30:05,"b'President of the @NHL_Oilers, Patrick Laforge, sends a message to our troops: https://t.co/OT4t3dmoXW #cdnpoli #NHL #Oilers'"
463770221162299393,2014-05-06 20:00:11,"b'Brian Burke, GM of the @NHLFlames, has a message for our troops. Watch here: https://t.co/8G6aEtbtdu @Burkie2020 #cdnpoli #NHL #DayofHonour'"
