id,created_at,text
586984473708756994,2015-04-11 20:09:38,b'Family photo with fellow leaders of the Americas in Panama this afternoon. #cdnpoli http://t.co/rH7yzT1zTM'
586957924020461569,2015-04-11 18:24:08,b'Met with President @BarackObama on the sidelines of the Summit of the Americas. #cdnpoli http://t.co/l5Rr5zjgBY'
586939233484541952,2015-04-11 17:09:52,b'Pleased to participate in the opening ceremonies &amp; official dinner at the Summit of the Americas last night. #cdnpoli http://t.co/HWDyUp2NQs'
586719209150885892,2015-04-11 02:35:34,"b""On the 1st Anniversary of our friend Jim Flaherty's death, we remember &amp; celebrate the life of a great man &amp; Cdn. http://t.co/nZyC3xcBFO"""
586661697768857600,2015-04-10 22:47:03,b'Held a business roundtable today in Panama City w/ my colleague @HonRobNicholson and Canadian CEOs. #cdnpoli http://t.co/DSV7VpI7ZU'
586624501141614593,2015-04-10 20:19:14,"b'Wheels down, Panama. Thank you for the warm welcome. #cdnpoli http://t.co/9xKmtPrkFb'"
586527732617633792,2015-04-10 13:54:43,b'En route to Panama City for the 7th Summit of the Americas. http://t.co/UlZ7BzGvZd'
586307191855939584,2015-04-09 23:18:22,"b'Watch 24 SEVEN: expansion of Canada Student Grants, the Thirty Meter Telescope @AskAnAstronomer, @MossomCreek &amp; more\nhttps://t.co/krf6YrAq6m'"
586187958429986819,2015-04-09 15:24:34,"b'On the 98th anniversary of the Battle of\xc2\xa0#VimyRidge, we remember the heroes who fought for the freedom we enjoy today http://t.co/WjEbrXHF8H'"
585814500365840384,2015-04-08 14:40:35,"b""Later this week I'll be attending the 7th Summit of the Americas in Panama City with @HonRobNicholson. Learn more: http://t.co/Bail10j2Ew"""
585791916425551872,2015-04-08 13:10:51,b'On behalf of all Cdns Laureen and I offer our deepest condolences to the family and church community of Cardinal Jean-Claude Turcotte.'
585570040105295873,2015-04-07 22:29:11,"b""In honour of #WorldHealthDay, watch my interview w/ @BillGates about Canada's global commitment to #MNCH. http://t.co/YR5UmNrLJJ"""
585547607470120960,2015-04-07 21:00:03,"b'Great tour of the @MossomCreek Hatchery today in Port Moody, BC, thanks for having us. #cdnpoli http://t.co/mPMIx4E65T'"
585515241628422144,2015-04-07 18:51:26,b'Cda Student Grants will help film students like the ones at Seycove High gain access to post-secondary funding. http://t.co/aZ9ijAcNuH'
585508387837837312,2015-04-07 18:24:12,b'Today I announced our Govt\xe2\x80\x99s intention to expand eligibility for Canada Student Grants. Read more: http://t.co/I7wjzew4X7 #cdnpoli'
585256948406321152,2015-04-07 01:45:04,b'Toured the incredible Gordon MacMillan Southam Observatory today with @JamesMoore_org. @AskAnAstronomer  #cdnpoli http://t.co/5CVEDhSK92'
585255928376725504,2015-04-07 01:41:01,"b""Proud to partner in the Thirty Meter Telescope project. Together we're working to advance global scientific discovery.http://t.co/xRqAoitha1"""
585135018734964737,2015-04-06 17:40:34,"b""As the @BlueJays start another season, let's all #cometogether and show the baseball world what Canada can do. Let's go Blue Jays!"""
584726413716127744,2015-04-05 14:36:55,b'On behalf of our family @LaureenHarper and I wish all those celebrating a very happy &amp; joyful Easter. Full ST: http://t.co/3wUnoM3dtH'
584378236647251968,2015-04-04 15:33:23,"b'Laureen and I express our sincere condolences to the family of Elmer Lach, famous member of the Punch Line. #Habs'"
584357948299829249,2015-04-04 14:12:46,b'Good luck to the incredible Team Canada as they play for another hockey gold this morning in Sweden! #WWHC2015'
584020664643891201,2015-04-03 15:52:31,"b'.@LaureenHarper and I wish all Cdns celebrating, at home &amp; abroad, a meaningful and peaceful Passover. My full ST: http://t.co/wCeS9J498h'"
583781626024501248,2015-04-03 00:02:40,"b'24 SEVEN: funding for infrastructure in QC, #CETA opens doors for @HondaCanada, #DaffodilMonth &amp; @LaureenHarper. http://t.co/kjJyWi1cWx'"
583763068733140993,2015-04-02 22:48:56,b'.@LaureenHarper &amp; I join Cdns\xc2\xa0today\xc2\xa0in celebrating #WorldAutismDay. It is important to raise awareness &amp; confront the challenges of autism.'
583730860605603841,2015-04-02 20:40:57,b'Productive meeting today w/ Premier @BrianGallantNB. Working together on jobs for NB &amp; Canada. #cdnpoli http://t.co/rurOC0taeo'
583694824320012288,2015-04-02 18:17:45,"b""Enjoyed meeting &amp; answering some great questions from Mrs.Gardiner's grade 3 class today in Miramichi, NB. @GretnaG http://t.co/M9COM8sVNs"""
583692806880829441,2015-04-02 18:09:44,"b'Proud to unveil the design of the new Pay Centre today in Miramichi w/ @RobMoore_CPC , MP Goguen &amp; MP O\xe2\x80\x99Neill-Gordon. http://t.co/44wt4qZYi1'"
583691652386070529,2015-04-02 18:05:09,"b""Our Gov't is fulfilling our commitment to establish a Public Service Pay Centre in Miramichi, NB. Read more:http://t.co/AnIWiVfOuo #cdnpoli"""
583252933099274240,2015-04-01 13:01:50,"b'I dedicate this post to the 810,000+ Canadians living with cancer. April is #DaffodilMonth. Join the fight.  http://t.co/bOh4qX7c8g'"
583010628849131520,2015-03-31 20:59:00,b'Thanks for visiting me! RT @CancerSociety Ava &amp; Anthony helped us launch #DaffodilMonth today with @pmharper. http://t.co/ZzYVEzVFiz'
583005378537000960,2015-03-31 20:38:08,"b'Marked the beginning of #DaffodilMonth w/ Ava, Anthony, @CancerSociety\xe2\x80\x99s Pamela Fralick &amp; @MinRonaAmbrose. http://t.co/y1TzuGX7Qv'"
582706516261756928,2015-03-31 00:50:34,"b""We're extremely proud of all members of the CAF engaged in this mission. We're honoured by their service, sacrifice &amp; bravery. #OpIMPACT"""
582706334791049216,2015-03-31 00:49:51,"b""We must act to protect Cdns against the threat of terrorism at home &amp; abroad. I'm pleased the HoC has passed our motion to do just that."""
582617700511424512,2015-03-30 18:57:38,b'Great to see the benefits of #CETA today @HondaCanada. #CETA will provide unprecedented access to the #EU market. http://t.co/bqZj2Z1b7I'
582615314053099520,2015-03-30 18:48:09,"b'Pleased to announce that thanks in part to #CETA, @hondacanada will ship its next generation CRVs to the #EU market. http://t.co/vpOqf2wR4Y'"
582597197432242177,2015-03-30 17:36:10,b'Thanks @HondaCanada for the tour of your Alliston plant &amp; for hosting us this afternoon. #cdnpoli http://t.co/7ceacZiNKW'
582582174995578880,2015-03-30 16:36:29,b'Hosted a roundtable w/ @KellieLeitch to discuss the benefits of #CETA for Canadian businesses &amp; the economy  #cdnpoli http://t.co/3IRGFRyFcZ'
581541736931045376,2015-03-27 19:42:09,b'Dropped in for a game of Petanque with the residents of the Manoir Beau Rivage de St-Gilles in Quebec today. http://t.co/2bN5tJQbdH'
581502549552799744,2015-03-27 17:06:26,"b""Jobs remain a top priority for our Gov't: I announced an additional 42 infrastructure projects in Quebec. http://t.co/KGvZL6s7Gc #cdnpoli"""
581501122252156928,2015-03-27 17:00:45,b'Happy to mark the grand opening of the St-Apollinaire Multifunctional Facility w/ Mayor Ouellet &amp; @JacquesGourde. http://t.co/ZGl1VJ5ZIR'
581289284700749824,2015-03-27 02:58:59,"b""Congratulations to Canada's @mhjd_85 &amp; @Rad85E for winning gold in pairs at the world figure skating championships. #WCShanghai"""
581237502427680768,2015-03-26 23:33:14,"b""24 SEVEN: #Nowruz in BC, our Government's motion to renew Canada\xe2\x80\x99s mission against ISIL, @LaureenHarper &amp; more. http://t.co/kjJyWi1cWx"""
580830748137111552,2015-03-25 20:36:56,"b'Happy to announce Prime Minister of India, @NarendraModi will be visiting Canada this spring. Read more: http://t.co/LnyfCzIiVh'"
580829740304637953,2015-03-25 20:32:56,"b'Met with India\xe2\x80\x99s High Commissioner Designate to Canada, Vishnu Prakash today in my Parliament Hill office. #cdnpoli http://t.co/Yheku1bK2g'"
580783103519662080,2015-03-25 17:27:36,"b'Canada joins our friends &amp; allies in France, Germany &amp; Spain in mourning the loss of the victims of the plane crash in France yesterday.'"
580497809104846848,2015-03-24 22:33:57,b'Watch my statement from earlier today in the HoC announcing a motion to extend Canada\xe2\x80\x99s mission against ISIL: http://t.co/nEmpYCJkUc'
580398322424393728,2015-03-24 15:58:38,"b'We are humbled &amp; eternally grateful to the CAF who never waver in defending our country, our families &amp; our values. http://t.co/YD3aoKU49G'"
580397591382384642,2015-03-24 15:55:43,b'We do not need to choose between fighting ISIL and helping its victims. We will continue to do both. #cdnpoli http://t.co/1DOgjgydhh'
580397262381191170,2015-03-24 15:54:25,"b""In our view, ISIL must cease to have any safe haven in Syria or around the globe. Our gov't is committed to keeping Canadians safe."""
580396384349777920,2015-03-24 15:50:55,b'The direction and resolve of our allies and partners in dealing with this threat of ISIL has not changed. http://t.co/XHLK8v7UlL #cdnpoli'
580395698610397184,2015-03-24 15:48:12,b'.@HonRobNicholson will table a motion seeking the support of the HoC to renew our military mission against ISIL for up to 12 months.'
580175140538970114,2015-03-24 01:11:47,"b'I encourage all Canadians both at home &amp; abroad to visit one of the 2,200 museums participating in #MuseumWeek: https://t.co/8VINbxpoxK'"
580099550569975809,2015-03-23 20:11:25,b'Pleased to announce that Janice Filmon will be the next LG of Manitoba. Learn more about her impressive background: http://t.co/40pTrO6psZ'
580060752507060224,2015-03-23 17:37:15,b'Discussed the evolving threat of terrorism posed to Canada &amp; the entire NATO Alliance w/ Sec. Gen. @jensstoltenberg. http://t.co/4BIk9dzJuo'
579833348677234688,2015-03-23 02:33:37,"b'Canada joins Singapore in mourning the loss of their former PM &amp; founding father, Lee Kuan Yew. My full ST: http://t.co/77kjvmkf5g'"
579660064505663488,2015-03-22 15:05:03,b'Celebrated #Nowruz last night in #Vancouver \xe2\x80\x93 Happy Persian New Year! http://t.co/1krxlepQ3L'
579450733877026816,2015-03-22 01:13:15,"b'Toured the Ismaili Centre in Burnaby today, beautiful facility. #cdnpoli http://t.co/5c84BU1Fp8'"
579369782404890624,2015-03-21 19:51:34,b'There has never been a better Canadian basketball player than @SteveNash. Congratulations on an incredible career. http://t.co/x1cqZ8YPM3'
579300700816949249,2015-03-21 15:17:04,b'RT @LaureenHarper: .@pmharper and I are wishing Odin a wonderful 13th birthday- we hope you had a great party. #odinbirthday'
579272209157496832,2015-03-21 13:23:51,b'Cda is a country built on diversity. Read my ST on International Day for the Elimination of Racial Discrimination: http://t.co/G54waEoEn5'
578907378902499328,2015-03-20 13:14:09,b'Wishing all Francophone communities both in Canada &amp; abroad a wonderful Journ\xc3\xa9e internationale de la Francophonie. http://t.co/y0Gl0gXcR9'
578731400607617024,2015-03-20 01:34:52,"b'Watch 24 SEVEN: support for infrastructure &amp; SMEs, #PMVA, @Raptors vs. @MNTimberwolves, @LaureenHarper &amp; more http://t.co/kjJyWhJBxX'"
578724375924318208,2015-03-20 01:06:58,"b""Tomorrow is la Journ\xc3\xa9e internationale de la Francophonie. Learn more about Canada's role in la Francophonie here: http://t.co/OeA1QfFh0n"""
578335294908440576,2015-03-18 23:20:53,"b""Pleased to meet Cda's top basketball talent @22wiggins &amp; @AnthonyBennett before @CanBball Night. http://t.co/4oC2d9hBUs"""
578324786025271296,2015-03-18 22:39:08,"b""Special Hockey Int'l Tournament 2015 hosted by @condorsottawa starts today. Good luck to all the exceptional players from around the world!"""
578297837454278656,2015-03-18 20:52:03,"b""Congrats to all the recipients of this year\xe2\x80\x99s Prime Minister's Volunteer Awards. Thank you for the tireless work you do in your communities."""
578288909756588032,2015-03-18 20:16:34,"b""In Toronto with @joeoliver1 honouring the recipients of the 3rd Prime Minister's Volunteer Awards: http://t.co/OPqZLjHP6Z #cdnpoli"""
578249711360090112,2015-03-18 17:40:49,b'Met with workers at @LynchGroup  following today\xe2\x80\x99s announcement. Thanks for having us today! #cdnpoli http://t.co/0A5H6dVEWG'
578248289449041920,2015-03-18 17:35:10,b'Toured the very impressive Lynch Fluid Controls today in Mississauga w/my colleague @BradButtMP. @LynchGroup #cdnpoli http://t.co/OktJXEeW89'
578246535592484864,2015-03-18 17:28:12,b'Today I announced new measures to support Canadian SMEs. Read more: http://t.co/Q0dQsqYNZX #cdnpoli'
578221282149445633,2015-03-18 15:47:51,b'Watch live as I announce new measures to support Canadian small and medium-sized enterprises: http://t.co/pPravxNLCq  #cdnpoli'
578220367719837697,2015-03-18 15:44:13,b'Canada will never recognize the Putin regime\xe2\x80\x99s annexation of Crimea. My full ST: http://t.co/EKD7ni7TGC #cdnpoli #Ukraine'
578218179371085824,2015-03-18 15:35:31,b'Horrified to learn of terrorist attacks in Tunisia. Canada stands with our allies in condemning these barbaric acts.'
578199633891078145,2015-03-18 14:21:49,"b""I congratulate PM Netanyahu on his election results. We look fwd to working w/ the gov't once formed. Israel has no greater friend than Cda."""
577922100503003136,2015-03-17 19:59:00,"b""In honour of St. Patrick's Day, here's a clip of Jim Flaherty &amp; me in Dublin learning how to pour perfect pints.\nhttps://t.co/c9LRAEnw0g"""
577864696558137344,2015-03-17 16:10:54,b'Congratulations to Jeffrey Orridge on being named commissioner of the @CFL. I look forward to watching you lead our game. #CFL'
577528890123501568,2015-03-16 17:56:32,b'RT @CFL: .@Ticats were all over @TheJUNOAwards last night thanks to @PMHarper &amp; @arkellsmusic! - http://t.co/MdjGfxEmC3 #CFL http://t.co/EL\xe2\x80\xa6'
577260678806818816,2015-03-16 00:10:45,"b""Good luck to all of the nominees and performers at this year's Junos. @TheJUNOAwards #JUNOS2015"""
576380357076975616,2015-03-13 13:52:40,"b'24 SEVEN: #IWD2015 w/ @girlguidesofcan, @MinPeterMacKay tables #Lifemeanslife &amp; @JamesMoore_org visits @SickKidsNews http://t.co/kjJyWi1cWx'"
576179838324625409,2015-03-13 00:35:53,"b'Thanks, @JerrysFood for the hospitality.  @Lynne_Yelich http://t.co/8SQimlopJt'"
576151138782818305,2015-03-12 22:41:50,b'Our government is committed to investing in infrastructure across Canada\xe2\x80\x99s rural areas. #cdnpoli #SARM http://t.co/FwhaHIXUY9'
576150521507147778,2015-03-12 22:39:23,b'Thank you Ray Orb and #SARM for hosting me today. #cdnpoli http://t.co/c9o4jP376A'
576113668007530496,2015-03-12 20:12:56,b'Met with workers of the Saskatoon Highway Repair Depot today following our announcement. #cdnpoli http://t.co/LOVpmvSwAT'
576113089671729152,2015-03-12 20:10:38,"b""Our gov't is committed to investing in CA\xe2\x80\x99s infrastructure to ensure future economic growth. @PremierBradWall http://t.co/rZavCbWioS"""
576107887304552448,2015-03-12 19:49:58,b'Today @PremierBradWall &amp; I announced funding for SK\xe2\x80\x99s Hwy 7 to generate economic &amp; social benefits for the province. http://t.co/tSc0lJCXhx'
575028819058364416,2015-03-09 20:22:08,b'Spoke to Iraqi PM Haider al-Abadi who offered his condolences on the death of Sgt Andrew Doiron today. #cdnpoli http://t.co/dIvQEbyMqd'
574962673110151169,2015-03-09 15:59:18,"b""Congratulations to Team Canada's @TeamJohnnyMo for their #Brier2015 win. @CurlingCanada"""
574589040592289792,2015-03-08 15:14:37,"b'On #InternationalWomensDay, I encourage all Canadians to thank the remarkable women who have influenced their lives. http://t.co/OManPOPPR7'"
574285541484560385,2015-03-07 19:08:37,"b'On behalf of all Canadians, Laureen &amp; I offer our deepest condolences to the family &amp; colleagues of Sergeant Doiron. http://t.co/f069pecAsG'"
573960595650789376,2015-03-06 21:37:24,"b""In honour of this Sunday's #InternationalWomensDay I met w/ some future leaders in my office today. @girlguidesofcan http://t.co/1Tws3sHoeV"""
573915163818074116,2015-03-06 18:36:52,b'Discussed shared priorities with Alberta Premier @JimPrentice in Ottawa today. #cdnpoli http://t.co/0RWXIRVlYq'
573875733782724609,2015-03-06 16:00:11,"b'Watch 24 SEVEN: New #lifemeanslife legislation, celebrating the Franklin find w/ @RCGS_SGRC,  @LaureenHarper &amp; more http://t.co/kjJyWi1cWx'"
573323383577833473,2015-03-05 03:25:21,b'Honoured to receive the Erebus Medal with my wife @LaureenHarper at the @ROMtoronto this evening. @RCGS_SGRC http://t.co/QRJDx5BqNr'
573243009564721153,2015-03-04 22:05:58,b'Nice to see my friends @OfficialGretzky and Bobby Orr on the fridge at @WexfordRest http://t.co/qcDTg7zpcz'
573201636023250944,2015-03-04 19:21:34,b'Announced our Govt\xe2\x80\x99s intent to introduce legislation to keep Canada\xe2\x80\x99s most heinous criminals behind bars for life. http://t.co/SxXFMyK4Tk'
573200815214743553,2015-03-04 19:18:18,b'Announced our Govt\xe2\x80\x99s intent to introduce legislation to keep Canada\xe2\x80\x99s most heinous criminals behind bars for life.'
573198565889089537,2015-03-04 19:09:22,"b""Our gov't is committed to keeping Canadian families safe. Read more about our proposed legislation here: http://t.co/1G6kIvvRPF #cdnpoli"""
572806118772236288,2015-03-03 17:09:55,"b""Today, the world marks the anniversary of the 1st organized hockey game ever played. 140 years later, hockey still remains Canada's sport."""
572557946900496384,2015-03-03 00:43:46,"b""Congratulations, Canada is proud of you MT @WomenOfAviation We're celebrating 100 years of #female #pilots in combat. #SupportOurTroops"""
572535844826820608,2015-03-02 23:15:57,"b""We're proud of our @CanadianForces. Best wishes to those deployed from CFB Trenton en route to Central &amp; Eastern Europe for #OpReassurance"""
572483665650962432,2015-03-02 19:48:36,"b""Great read MT @McGillU 140 yrs ago this week: The world's 1st organized indoor #hockey game was played http://t.co/bfqgI4w9ez"""
572416585161445377,2015-03-02 15:22:03,"b'Great to meet Olympic curling bronze medalist, Shannon Kleibrink at #Brier2015 . Congratulations to all the athletes http://t.co/sINODKKJvq'"
571516700518166529,2015-02-28 03:46:14,b'Canada extends our deepest condolences to Mr. Nemtsov\xe2\x80\x99s family &amp; friends. Read my full statement here: http://t.co/gPfaH0mMrB #cdnpoli'
571400476215918592,2015-02-27 20:04:24,b'Great meeting with players from the Canadian @amputeehockey league who are in town for training camp. http://t.co/5iSCXOvgMF'
571390389279727616,2015-02-27 19:24:19,"b'As we mark this important anniversary in Ukraine, Canada re-commits to standing firmly w/ its citizens. Read more: http://t.co/p39O3vQ8Rt'"
571116890862456832,2015-02-27 01:17:32,"b'Watch 24 SEVEN: exclusive interview w/ @BillGates, #MNCH w/ @redcrosscanada &amp; @Gatesfoundation, #LunarNewYear &amp; more. http://t.co/kjJyWhJBxX'"
571040961901543424,2015-02-26 20:15:49,"b'On behalf of all Canadians, Laureen &amp; I offer our deepest condolences to the family of WWII Veteran &amp; true Canadian hero, Mr. Ernest C\xc3\xb4t\xc3\xa9.'"
570973884226379776,2015-02-26 15:49:16,"b'Great to see that @EdmontonOilers locker-room attendant &amp; key team member, Joey Moss, will be inducted into the AB Sports Hall of Fame.'"
570711007238201344,2015-02-25 22:24:42,b'Our commitment to #SavingLives of mothers &amp; children will not waver.  @gatesfoundation @BillGates @redcrosscanada http://t.co/5llCyiLu9i'
570707405916520449,2015-02-25 22:10:23,b'I announced new investments toward improving access to vaccines for mothers &amp; children. http://t.co/hnPEEAfDgG @redcrosscanada @BillGates'
570675262033174528,2015-02-25 20:02:39,b'Watch live as @BillGates and I discuss #MNCH here:  http://t.co/pPravxNLCq @gatesfoundation #savinglives'
570667165713604608,2015-02-25 19:30:29,b'Speaking w/ @BillGates about the importance of taking care of women &amp;children around the globe #MNCH @gatesfoundation http://t.co/QndIoZRVpI'
570622676580085760,2015-02-25 16:33:42,"b'RT @LaureenHarper: Today is National #PinkShirtDay. Take a stand against bullying by wearing pink, talking to loved ones &amp; raising awarenes\xe2\x80\xa6'"
569982275342999552,2015-02-23 22:08:58,b'Congratulations to @RugbyCanada &amp; @CanadaSevens on being chosen to host the World Rugby Sevens in #Vancouver March 2016. @bcplace'
569873954380365825,2015-02-23 14:58:33,"b""Congratulations to all of the Canadian winners &amp; nominees at this year\xe2\x80\x99s #Oscars. You've made Canada very proud. http://t.co/Yv9crgoSlH"""
568950168231415808,2015-02-21 01:47:45,b'Honoured to receive a scroll from Abbess Venerable\xc2\xa0Yung ku today at the Fo Guang Shan Temple\xc2\xa0#cdnpoli http://t.co/QeREqW0IsO'
568949747798552576,2015-02-21 01:46:05,b'Celebrating\xc2\xa0#LunarNewYear\xc2\xa0today at the Fo Guang Shan Temple in Mississauga w/ my colleagues \xc2\xa0@jkenney\xc2\xa0and\xc2\xa0@BradButtMP http://t.co/WpHhdHPv6L'
568949496773652481,2015-02-21 01:45:05,b'Paying my respects to Abbess Venerable\xc2\xa0Yung ku at the #LunarNewYear celebration at the Fo Guang Shan Temple http://t.co/WSMymSjSkE'
568606588543459328,2015-02-20 03:02:29,"b'Watch 24 SEVEN:\xc2\xa0@CarnavalQc, new legislation to support victims, celebrate\xc2\xa0#Flag50,\xc2\xa0@LaureenHarper\xc2\xa0&amp; more http://t.co/WLUAOprPzt #cdnpoli'"
568595676612800512,2015-02-20 02:19:07,b'Productive meeting with Premier @christyclarkbc today following my announcement in BC. #cdnpoli http://t.co/ceLv7tVxUL'
568590335535755264,2015-02-20 01:57:54,"b""Our gov't is committed to job creation by supporting the emerging LNG industry, read about my announcement in BC: http://t.co/Df4bfY3za2"""
568559593820966913,2015-02-19 23:55:45,b'Meeting w/ residents at Austin Harris Residence today in BC w/ @AliceWongCanada for Chinese New Year @SUCCESSCanada http://t.co/P1S3Nc7oDA'
568558267871432704,2015-02-19 23:50:29,b'Chinese New Year celebrations at Austin Harris Residence today w/ @LaureenHarper &amp; @AliceWongCanada.  @SUCCESSCanada http://t.co/VTvt1Bqxlb'
568451811595698176,2015-02-19 16:47:27,"b'Participating in the dotting the dragon ritual at a Chinese New Year celebration in Richmond, BC. #LunarNewYear http://t.co/UfkfqasJzi'"
568448344894394369,2015-02-19 16:33:41,"b'Happy to celebrate Chinese New Year with my colleagues, @AliceWongCanada , @WaiYoung and @JamesMoore_org in #RichmondBc'"
568447414698446848,2015-02-19 16:29:59,"b'Laureen &amp; I extend our best wishes to all those celebrating the Lunar New Year in Canada, Asia and around the world http://t.co/eCNzQUirja'"
568029170393079808,2015-02-18 12:48:02,b'Canada stands w/ the people of Ukraine. Learn more about additional sanctions against ongoing Russian aggression: http://t.co/jUqAqN3Co0'
567800162710728705,2015-02-17 21:38:02,b'Offered Canada\xe2\x80\x99s condolences to Ambassador Abrahamsen &amp; the people of Denmark in light of Saturday\xe2\x80\x99s acts of terror. http://t.co/4VQOQgOXYS'
567484064148783104,2015-02-17 00:41:58,b'Congrats to all participants of the #ACFWLHG for beating the @GWR for longest hockey game &amp; raising money for a great cause! @albertacancer'
567470232516972545,2015-02-16 23:47:01,"b""Offered condolences to Anba Mina, Bishop of the Coptic Orthodox Diocese of Canada for ISIL's recent act of brutality. http://t.co/uYazLC9hEh"""
567163632749150208,2015-02-16 03:28:42,b'Canada is outraged by the beheadings of Egyptian Coptic Orthodox Christians in Libya by groups linked to ISIL. ST: http://t.co/nximg4znnF'
566990109090656257,2015-02-15 15:59:10,"b'Proud to present WWll vet, Mr. Cauchy w/ a Cdn Flag on Friday in honour of National Flag Day @MinStevenBlaney http://t.co/jOR73Kalqg'"
566984290760945665,2015-02-15 15:36:03,"b""Today we celebrate Canada's Flag, a symbol of the values of peace, democracy, freedom &amp;justice that define &amp; unite us http://t.co/VPPiqskM4i"""
566715376977719296,2015-02-14 21:47:29,b'Horrified by the act of terror in Copenhagen. Our thoughts &amp; prayers are w/Denmark. We stand strong w/our allies against such atrocities.'
566297877274972160,2015-02-13 18:08:29,b'Celebrating the 15th anniversary of the beautiful \xe2\x80\x9cHotel de Glace\xe2\x80\x9d here in #Quebec @CarnavalQc @Hoteldeglace http://t.co/rKyJkPBjtD'
566295833931694080,2015-02-13 18:00:22,"b'Happy to be back in Quebec City for Carnaval with my friend, Bonhomme. @CarnavalQc #Quebec #Bonhomme http://t.co/4b0dg009Be'"
566294266218283008,2015-02-13 17:54:08,b'Just out for a ride with the Federation des motoneigistes du Quebec. @Fed_MotoneigeQc http://t.co/Ihqit93S31'
566253091511885824,2015-02-13 15:10:32,b'Roundtable &amp; pre-budget consultation w/ @DenisLebelPCC &amp; local business leaders in Quebec City this morning #cdnpoli http://t.co/fIFbTT9mcA'
566034385422413825,2015-02-13 00:41:28,b'With Mayor Lebeaume signing a card to show our support for the Quebec City bridge. http://t.co/XvNtbFMpAl'
566025222331973633,2015-02-13 00:05:03,"b""Pleased to see plans for the @mnbaq Pierre Lassonde pavillion- looking forward to visiting when it's complete! http://t.co/PnR3vDf7IK"""
565968881660227584,2015-02-12 20:21:11,"b'Under the proposed legislation, repeat violent offenders will no longer be granted statutory release after serving 2/3\xe2\x80\x99s of their sentence.'"
565968394777001984,2015-02-12 20:19:15,b'Repeat violent offenders should never be granted automatic early release. #cdnpoli http://t.co/J7FzCFSMuE'
565967677785927681,2015-02-12 20:16:24,"b""Today I announced our gov't\xe2\x80\x99s intention to introduce new legislation to further protect Canadian families. Read more: http://t.co/Nal6H38KYi"""
565950112556666881,2015-02-12 19:06:36,"b'Held a roundtable in QC w/ Sen. Boisvenu, @DenisLebelPCC &amp; @MinStevenBlaney on putting the rights of victims first. http://t.co/yssgzyGa8q'"
